{"$id":"storage-taxonomy-decision-v1","$schema":"https://json-schema.org/draft/2020-12/schema","additionalProperties":false,"properties":{"campaign_version":{"const":"storage-taxonomy-v2-20260813"},"canonical_decision":{"additionalProperties":false,"properties":{"evidence":{"items":{"additionalProperties":false,"properties":{"quote":{"minLength":1,"type":"string"},"surface":{"enum":["title","body"]},"url":{"type":"string"}},"required":["url","surface","quote"],"type":"object"},"type":"array"},"generation_sources":{"items":{"type":"string"},"type":"array"},"proposed_category":{"type":"string"},"proposed_subcategory":{"type":["string","null"]},"storage_energy_mwh":{"minimum":0,"type":["number","null"]},"storage_power_mw":{"minimum":0,"type":["number","null"]},"storage_status":{"enum":["confirmed","planned","optional","unclear","not_mentioned"]},"technology_tags":{"items":{"type":"string"},"type":"array","uniqueItems":true}},"required":["generation_sources","storage_status","storage_power_mw","storage_energy_mwh","proposed_category","proposed_subcategory","technology_tags","evidence"],"type":"object"},"confidence":{"maximum":1,"minimum":0,"type":"number"},"event_decisions":{"items":{"additionalProperties":false,"properties":{"energy_composition_evidence":{"items":{"additionalProperties":false,"properties":{"quote":{"minLength":1,"type":"string"},"surface":{"enum":["title","body"]},"url":{"type":"string"}},"required":["url","surface","quote"],"type":"object"},"type":"array"},"event_id":{"type":"string"},"generation_sources":{"items":{"type":"string"},"type":"array"},"storage_energy_mwh":{"minimum":0,"type":["number","null"]},"storage_energy_mwh_raw":{"type":["string","null"]},"storage_power_mw":{"minimum":0,"type":["number","null"]},"storage_power_mw_raw":{"type":["string","null"]},"storage_status":{"enum":["confirmed","planned","optional","unclear","not_mentioned"]}},"required":["event_id","generation_sources","storage_status","storage_power_mw","storage_energy_mwh","storage_power_mw_raw","storage_energy_mwh_raw","energy_composition_evidence"],"type":"object"},"type":"array"},"model":{"type":"string"},"package_sha256":{"pattern":"^[0-9a-f]{64}$","type":"string"},"parent_decision_sha256":{"pattern":"^[0-9a-f]{64}$","type":["string","null"]},"project_id":{"type":"string"},"resolution":{"enum":["resolved","needs_manual_review"]},"review_reason":{"type":["string","null"]},"role":{"enum":["terra","sol"]},"schema_version":{"const":"storage-taxonomy-decision-v1"}},"required":["schema_version","campaign_version","project_id","package_sha256","role","model","resolution","confidence","review_reason","canonical_decision","event_decisions"],"type":"object"}
