{
  "schema_version": "storage-taxonomy-decision-v1",
  "campaign_version": "storage-taxonomy-v2-20260813",
  "project_id": "GRC-ES-0002",
  "package_sha256": "47bc618d93e4c167e6b4d4c39cc7ee4e5590ab315a8d67695571bddce0259489",
  "role": "terra",
  "model": "gpt-5.6-terra",
  "resolution": "resolved",
  "confidence": 0.94,
  "review_reason": null,
  "canonical_decision": {
    "generation_sources": [],
    "storage_status": "confirmed",
    "storage_power_mw": 50,
    "storage_energy_mwh": 130,
    "proposed_category": "储能",
    "proposed_subcategory": null,
    "technology_tags": [],
    "evidence": [
      {
        "url": "https://news.goalfore.cn/topstories/detail/85241.html",
        "surface": "title",
        "quote": "南都电源拿下希腊130MWh储能项目，欧洲市场再落一子"
      },
      {
        "url": "https://news.goalfore.cn/topstories/detail/85241.html",
        "surface": "body",
        "quote": "7月15日，中国储能龙头企业南都电源宣布与希腊某能源公司正式签订供货合同，将为其位于希腊的独立储能项目提供总装机容量达130MWh的整套储能系统解决方案。\n根据协议，南都电源将为该项目提供包含交直流侧设备在内的完整储能系统。直流侧采用该公司最新一代Center L Plus 5MWh液冷储能系统，并"
      }
    ]
  },
  "event_decisions": [
    {
      "event_id": "GRC-ES-0002-01",
      "generation_sources": [],
      "storage_status": "confirmed",
      "storage_power_mw": 50,
      "storage_energy_mwh": 130,
      "storage_power_mw_raw": "50MW",
      "storage_energy_mwh_raw": "130MWh",
      "energy_composition_evidence": [
        {
          "url": "https://news.goalfore.cn/topstories/detail/85241.html",
          "surface": "title",
          "quote": "南都电源拿下希腊130MWh储能项目，欧洲市场再落一子"
        },
        {
          "url": "https://news.goalfore.cn/topstories/detail/85241.html",
          "surface": "body",
          "quote": "7月15日，中国储能龙头企业南都电源宣布与希腊某能源公司正式签订供货合同，将为其位于希腊的独立储能项目提供总装机容量达130MWh的整套储能系统解决方案。\n根据协议，南都电源将为该项目提供包含交直流侧设备在内的完整储能系统。直流侧采用该公司最新一代Center L Plus 5MWh液冷储能系统，并"
        }
      ]
    }
  ]
}
