{"schema_version":"storage-taxonomy-decision-v1","campaign_version":"storage-taxonomy-v2-20260813","project_id":"UZB-HB-0025","package_sha256":"2cb2f18a5aff8d818909d423eafa0e300c491932b6cc3b3eaa718e483345d3d1","role":"sol","model":"gpt-5.6-sol","resolution":"resolved","confidence":0.97,"review_reason":null,"canonical_decision":{"generation_sources":["光伏","风电","生物质"],"storage_status":"confirmed","storage_power_mw":150,"storage_energy_mwh":300,"proposed_category":"综合能源","proposed_subcategory":null,"technology_tags":["风光生物质储"],"evidence":[{"url":"https://news.goalfore.cn/topstories/detail/76201.html","surface":"body","quote":"乌兹别克斯坦总统米尔济约耶夫发表致辞，并对中国能建投资建设的安集延洛奇150MW/300MWh储能项目、费尔干纳奥兹150MW/300MWh储能项目成功并网和纳沃伊风光储综合能源项目顺利开工表示祝贺。"},{"url":"https://news.goalfore.cn/topstories/detail/76201.html","surface":"body","quote":"是中国能建首个境外投资的“风光储一体化”综合能源项目"},{"url":"https://news.goalfore.cn/topstories/detail/59115.html","surface":"body","quote":"海投公司纳沃伊综合能源项目在活动中正式完成协议签约，标志着中国能建首个境外投资的“风光储一体化”综合能源项目实现实质性推进。"},{"url":"https://news.goalfore.cn/topstories/detail/57465.html","surface":"body","quote":"英国苏格兰6.6兆瓦垃圾发电项目"},{"url":"https://news.goalfore.cn/topstories/detail/57465.html","surface":"body","quote":"乌兹别克斯坦纳沃伊风光储一体化项目"},{"url":"https://news.goalfore.cn/topstories/detail/59115.html","surface":"body","quote":"本次签约亮相的纳沃伊综合能源项目，由300兆瓦光伏、300兆瓦风电和150兆瓦/300兆瓦时储能组成，预计投资总额将超过7亿美元。"}]},"event_decisions":[{"event_id":"UZB-HB-0025-01","generation_sources":["光伏","风电"],"storage_status":"confirmed","storage_power_mw":150,"storage_energy_mwh":300,"storage_power_mw_raw":"150MW","storage_energy_mwh_raw":"300MWh","energy_composition_evidence":[{"url":"https://news.goalfore.cn/topstories/detail/76201.html","surface":"body","quote":"乌兹别克斯坦总统米尔济约耶夫发表致辞，并对中国能建投资建设的安集延洛奇150MW/300MWh储能项目、费尔干纳奥兹150MW/300MWh储能项目成功并网和纳沃伊风光储综合能源项目顺利开工表示祝贺。"},{"url":"https://news.goalfore.cn/topstories/detail/76201.html","surface":"body","quote":"是中国能建首个境外投资的“风光储一体化”综合能源项目"}]},{"event_id":"UZB-HB-0025-02","generation_sources":["光伏","风电","生物质"],"storage_status":"confirmed","storage_power_mw":150,"storage_energy_mwh":300,"storage_power_mw_raw":"150兆瓦","storage_energy_mwh_raw":"300兆瓦时","energy_composition_evidence":[{"url":"https://news.goalfore.cn/topstories/detail/59115.html","surface":"body","quote":"海投公司纳沃伊综合能源项目在活动中正式完成协议签约，标志着中国能建首个境外投资的“风光储一体化”综合能源项目实现实质性推进。"},{"url":"https://news.goalfore.cn/topstories/detail/57465.html","surface":"body","quote":"英国苏格兰6.6兆瓦垃圾发电项目"},{"url":"https://news.goalfore.cn/topstories/detail/57465.html","surface":"body","quote":"乌兹别克斯坦纳沃伊风光储一体化项目"},{"url":"https://news.goalfore.cn/topstories/detail/59115.html","surface":"body","quote":"本次签约亮相的纳沃伊综合能源项目，由300兆瓦光伏、300兆瓦风电和150兆瓦/300兆瓦时储能组成，预计投资总额将超过7亿美元。"}]}],"parent_decision_sha256":"059dc0eb08686d338e9fcd2bdb7d93593223a0987b71342457bedbd1d277a553"}
