{"schema_version":"storage-taxonomy-decision-v1","campaign_version":"storage-taxonomy-v2-20260813","project_id":"IND-HB-0005","package_sha256":"c711074fef8e6c0b727edb99b556c051aeed2aa16768642e63f2b57f759719ad","role":"sol","model":"gpt-5.6-sol","resolution":"resolved","confidence":0.94,"review_reason":null,"canonical_decision":{"generation_sources":["光伏","风电"],"storage_status":"not_mentioned","storage_power_mw":null,"storage_energy_mwh":null,"proposed_category":"综合能源","proposed_subcategory":null,"technology_tags":["风光"],"evidence":[{"url":"https://news.goalfore.cn/topstories/detail/41481.html","surface":"body","quote":"该公司表示：“Serentica将在印度卡纳塔克邦（Karnataka）、马哈拉施特拉邦（Maharashtra）、安得拉邦（Andhra）和拉贾斯坦邦（Rajasthan）建设光伏和风能项目，并解决与省间输电系统（ISTS）的并网问题。”\n对于其在\n马哈拉施特拉邦（Maharashtra）和卡纳塔克邦（Karnataka）的风电项目，该公司已与印度本土整机商苏司兰(Suzlon)、德国西门子歌美飒(Siemens Gamesa)和来自中国的远景能源(Env"},{"url":"https://news.goalfore.cn/topstories/detail/41481.html","surface":"body","quote":"该公司表示：“Serentica将在印度卡纳塔克邦（Karnataka）、马哈拉施特拉邦（Maharashtra）、安得拉邦（Andhra）和拉贾斯坦邦（Rajasthan）建设光伏和风能项目，并解决与省间输电系统（ISTS）的并网问题。”\n对于其在\n马哈拉施特拉邦（Maharashtra）和卡纳塔克邦（Karnataka）的风电项目，该公司已与印度本土整机商苏司兰(Suzlon)、德国西门子歌美飒(Siemens Gamesa)和来自中国的远景能源(Envision"}]},"event_decisions":[{"event_id":"IND-HB-0005-01","generation_sources":["光伏","风电"],"storage_status":"not_mentioned","storage_power_mw":null,"storage_energy_mwh":null,"storage_power_mw_raw":null,"storage_energy_mwh_raw":null,"energy_composition_evidence":[{"url":"https://news.goalfore.cn/topstories/detail/41481.html","surface":"body","quote":"该公司表示：“Serentica将在印度卡纳塔克邦（Karnataka）、马哈拉施特拉邦（Maharashtra）、安得拉邦（Andhra）和拉贾斯坦邦（Rajasthan）建设光伏和风能项目，并解决与省间输电系统（ISTS）的并网问题。”\n对于其在\n马哈拉施特拉邦（Maharashtra）和卡纳塔克邦（Karnataka）的风电项目，该公司已与印度本土整机商苏司兰(Suzlon)、德国西门子歌美飒(Siemens Gamesa)和来自中国的远景能源(Env"},{"url":"https://news.goalfore.cn/topstories/detail/41481.html","surface":"body","quote":"该公司表示：“Serentica将在印度卡纳塔克邦（Karnataka）、马哈拉施特拉邦（Maharashtra）、安得拉邦（Andhra）和拉贾斯坦邦（Rajasthan）建设光伏和风能项目，并解决与省间输电系统（ISTS）的并网问题。”\n对于其在\n马哈拉施特拉邦（Maharashtra）和卡纳塔克邦（Karnataka）的风电项目，该公司已与印度本土整机商苏司兰(Suzlon)、德国西门子歌美飒(Siemens Gamesa)和来自中国的远景能源(Envision"}]}],"parent_decision_sha256":"d942c42e3f956bcdffad2c5b3386184e800d2efb0e1af8102707d862ce3caf3b"}
