{
  "schema_version": "storage-taxonomy-decision-v1",
  "campaign_version": "storage-taxonomy-v2-20260813",
  "project_id": "VNM-MF-0003",
  "package_sha256": "d961392229a77994ee2e03298d7505941ff1ea59d89eaf3353cdc3c1c0b1f29d",
  "role": "terra",
  "model": "gpt-5.6-terra",
  "resolution": "resolved",
  "confidence": 0.94,
  "review_reason": null,
  "canonical_decision": {
    "generation_sources": [],
    "storage_status": "not_mentioned",
    "storage_power_mw": null,
    "storage_energy_mwh": null,
    "proposed_category": "新能源制造业",
    "proposed_subcategory": null,
    "technology_tags": [],
    "evidence": [
      {
        "url": "https://news.goalfore.cn/topstories/detail/60015.html",
        "surface": "title",
        "quote": "中国建筑（东南亚）有限公司中标晶科能源越南海河光伏电池技术一体化项目"
      }
    ]
  },
  "event_decisions": [
    {
      "event_id": "VNM-MF-0003-01",
      "generation_sources": [],
      "storage_status": "not_mentioned",
      "storage_power_mw": null,
      "storage_energy_mwh": null,
      "storage_power_mw_raw": null,
      "storage_energy_mwh_raw": null,
      "energy_composition_evidence": [
        {
          "url": "https://news.goalfore.cn/topstories/detail/60015.html",
          "surface": "title",
          "quote": "中国建筑（东南亚）有限公司中标晶科能源越南海河光伏电池技术一体化项目"
        }
      ]
    }
  ]
}
