{
  "schema_version": "storage-taxonomy-decision-v1",
  "campaign_version": "storage-taxonomy-v2-20260813",
  "project_id": "GIN-HB-0002",
  "package_sha256": "11d21f0af904775e132407610f38e193fb8363ab2627f817e300683a2a07619f",
  "role": "terra",
  "model": "gpt-5.6-terra",
  "resolution": "resolved",
  "confidence": 0.94,
  "review_reason": null,
  "canonical_decision": {
    "generation_sources": [
      "光伏"
    ],
    "storage_status": "confirmed",
    "storage_power_mw": 0.04956,
    "storage_energy_mwh": null,
    "proposed_category": "光伏",
    "proposed_subcategory": null,
    "technology_tags": [
      "光储"
    ],
    "evidence": [
      {
        "url": "https://news.goalfore.cn/topstories/detail/88832.html",
        "surface": "title",
        "quote": "四达时代圆满完成几内亚国家电视台及农村广播站光伏储能项目工程并通过验收"
      },
      {
        "url": "https://news.goalfore.cn/topstories/detail/88832.html",
        "surface": "body",
        "quote": "2025年4月26日，随着几内亚国家电视台及多个农村广播站的太阳能离网光储供电系统全面竣工，并顺利通过甲方验收，四达时代承建的“几内亚国家电视台及农村广播站光伏储能项目”正式宣告圆满完成。\n该项目自2025年2月7日启动，历时两个月，克服了地势险峻、交通不便、施工环境恶劣等诸多困难，在四达时代团队的专业策划与精心组织下，按时、高质量地完成了各项建设任务"
      },
      {
        "url": "https://news.goalfore.cn/topstories/detail/81963.html",
        "surface": "title",
        "quote": "四达时代圆满完成几内亚国家电视台及农村广播站光伏储能项目工程并通过验收"
      },
      {
        "url": "https://news.goalfore.cn/topstories/detail/81963.html",
        "surface": "body",
        "quote": "2025年4月26日，随着几内亚国家电视台及多个农村广播站的太阳能离网光储供电系统全面竣工，并顺利通过甲方验收，四达时代承建的“几内亚国家电视台及农村广播站光伏储能项目”正式宣告圆满完成。\n该项目自2025年2月7日启动，历时两个月，克服了地势险峻、交通不便、施工环境恶劣等诸多困难，在四达时代团队的专业策划与精心组织下，按时、高质量地完成了各项建设任务"
      }
    ]
  },
  "event_decisions": [
    {
      "event_id": "GIN-HB-0002-01",
      "generation_sources": [
        "光伏"
      ],
      "storage_status": "confirmed",
      "storage_power_mw": 0.04956,
      "storage_energy_mwh": null,
      "storage_power_mw_raw": "49.56kW",
      "storage_energy_mwh_raw": null,
      "energy_composition_evidence": [
        {
          "url": "https://news.goalfore.cn/topstories/detail/88832.html",
          "surface": "title",
          "quote": "四达时代圆满完成几内亚国家电视台及农村广播站光伏储能项目工程并通过验收"
        },
        {
          "url": "https://news.goalfore.cn/topstories/detail/88832.html",
          "surface": "body",
          "quote": "2025年4月26日，随着几内亚国家电视台及多个农村广播站的太阳能离网光储供电系统全面竣工，并顺利通过甲方验收，四达时代承建的“几内亚国家电视台及农村广播站光伏储能项目”正式宣告圆满完成。\n该项目自2025年2月7日启动，历时两个月，克服了地势险峻、交通不便、施工环境恶劣等诸多困难，在四达时代团队的专业策划与精心组织下，按时、高质量地完成了各项建设任务"
        },
        {
          "url": "https://news.goalfore.cn/topstories/detail/81963.html",
          "surface": "title",
          "quote": "四达时代圆满完成几内亚国家电视台及农村广播站光伏储能项目工程并通过验收"
        },
        {
          "url": "https://news.goalfore.cn/topstories/detail/81963.html",
          "surface": "body",
          "quote": "2025年4月26日，随着几内亚国家电视台及多个农村广播站的太阳能离网光储供电系统全面竣工，并顺利通过甲方验收，四达时代承建的“几内亚国家电视台及农村广播站光伏储能项目”正式宣告圆满完成。\n该项目自2025年2月7日启动，历时两个月，克服了地势险峻、交通不便、施工环境恶劣等诸多困难，在四达时代团队的专业策划与精心组织下，按时、高质量地完成了各项建设任务"
        }
      ]
    }
  ]
}
