{
  "schema_version": "storage-taxonomy-decision-v1",
  "campaign_version": "storage-taxonomy-v2-20260813",
  "project_id": "IDN-HB-0017",
  "package_sha256": "9aa90825f40de45f65984ab1609a3ae7b04364a6c5c5402268b27d13f6880cb9",
  "role": "terra",
  "model": "gpt-5.6-terra",
  "resolution": "needs_manual_review",
  "confidence": 0.7,
  "review_reason": "package evidence does not resolve a generation source or confirmed standalone storage",
  "canonical_decision": {
    "generation_sources": [],
    "storage_status": "not_mentioned",
    "storage_power_mw": null,
    "storage_energy_mwh": null,
    "proposed_category": "综合能源",
    "proposed_subcategory": null,
    "technology_tags": [],
    "evidence": [
      {
        "url": "https://news.goalfore.cn/topstories/detail/80478.html",
        "surface": "title",
        "quote": "中国水业集团签订印尼垃圾填埋场填埋气发电项目"
      }
    ]
  },
  "event_decisions": [
    {
      "event_id": "IDN-HB-0017-01",
      "generation_sources": [],
      "storage_status": "not_mentioned",
      "storage_power_mw": null,
      "storage_energy_mwh": null,
      "storage_power_mw_raw": null,
      "storage_energy_mwh_raw": null,
      "energy_composition_evidence": [
        {
          "url": "https://news.goalfore.cn/topstories/detail/80478.html",
          "surface": "title",
          "quote": "中国水业集团签订印尼垃圾填埋场填埋气发电项目"
        }
      ]
    }
  ]
}
