{
  "schema_version": "storage-taxonomy-decision-v1",
  "campaign_version": "storage-taxonomy-v2-20260813",
  "project_id": "BHR-HB-0004",
  "package_sha256": "241069825d0995c25ff99eee1c4b41b99c8933d95a1940315104826a153dd4a4",
  "role": "terra",
  "model": "gpt-5.6-terra",
  "resolution": "needs_manual_review",
  "confidence": 0.7,
  "review_reason": "package evidence does not resolve a generation source or confirmed standalone storage",
  "canonical_decision": {
    "generation_sources": [],
    "storage_status": "not_mentioned",
    "storage_power_mw": null,
    "storage_energy_mwh": null,
    "proposed_category": "综合能源",
    "proposed_subcategory": null,
    "technology_tags": [],
    "evidence": [
      {
        "url": "https://news.goalfore.cn/topstories/detail/78457.html",
        "surface": "title",
        "quote": "巴林海水淡化项目招标，这家中国开发商入围资审"
      }
    ]
  },
  "event_decisions": [
    {
      "event_id": "BHR-HB-0004-01",
      "generation_sources": [],
      "storage_status": "not_mentioned",
      "storage_power_mw": null,
      "storage_energy_mwh": null,
      "storage_power_mw_raw": null,
      "storage_energy_mwh_raw": null,
      "energy_composition_evidence": [
        {
          "url": "https://news.goalfore.cn/topstories/detail/78457.html",
          "surface": "title",
          "quote": "巴林海水淡化项目招标，这家中国开发商入围资审"
        }
      ]
    }
  ]
}
