{
  "schema_version": "storage-taxonomy-decision-v1",
  "campaign_version": "storage-taxonomy-v2-20260813",
  "project_id": "DNK-ES-0002",
  "package_sha256": "f91863b8e256351cb91be74069d426263799d662872cf09a0e96db6154e8e3dc",
  "role": "terra",
  "model": "gpt-5.6-terra",
  "resolution": "resolved",
  "confidence": 0.94,
  "review_reason": null,
  "canonical_decision": {
    "generation_sources": [],
    "storage_status": "confirmed",
    "storage_power_mw": 1000,
    "storage_energy_mwh": 3000,
    "proposed_category": "储能",
    "proposed_subcategory": null,
    "technology_tags": [],
    "evidence": [
      {
        "url": "https://news.goalfore.cn/topstories/detail/87335.html",
        "surface": "title",
        "quote": "海辰储能再签3GWh大单，加速布局北欧储能市场"
      },
      {
        "url": "https://news.goalfore.cn/topstories/detail/87335.html",
        "surface": "body",
        "quote": "9月5日，海辰储能宣布与可再生能源领军企业BOS Power（Bertel O. Steen Power Solutions）签署合作协议。双方计划于2027年前在丹麦、瑞典、芬兰及挪威部署总规模达3GWh的储能系统项目。\n这是海辰储能继8月与沙特电力公司签订1GW/4GWh储能项目后，在全球化布"
      },
      {
        "url": "https://news.goalfore.cn/topstories/detail/87273.html",
        "surface": "title",
        "quote": "海辰储能与BOS Power达成合作，助力北欧绿色能源转型"
      },
      {
        "url": "https://news.goalfore.cn/topstories/detail/87273.html",
        "surface": "body",
        "quote": "2025年9月5日，海辰储能宣布与可再生能源领军企业BOS Power（Bertel O. Steen Power Solutions，简称BOS Power）签署合作协议，计划于2027年前在丹麦、瑞典、芬兰及挪威部署总规模达3GWh的储能系统项目。\n签约仪式现场\n该协议覆盖一系列电力储能项目，单体容量3"
      }
    ]
  },
  "event_decisions": [
    {
      "event_id": "DNK-ES-0002-01",
      "generation_sources": [],
      "storage_status": "confirmed",
      "storage_power_mw": 1000,
      "storage_energy_mwh": 3000,
      "storage_power_mw_raw": "1GW",
      "storage_energy_mwh_raw": "3GWh",
      "energy_composition_evidence": [
        {
          "url": "https://news.goalfore.cn/topstories/detail/87335.html",
          "surface": "title",
          "quote": "海辰储能再签3GWh大单，加速布局北欧储能市场"
        },
        {
          "url": "https://news.goalfore.cn/topstories/detail/87335.html",
          "surface": "body",
          "quote": "9月5日，海辰储能宣布与可再生能源领军企业BOS Power（Bertel O. Steen Power Solutions）签署合作协议。双方计划于2027年前在丹麦、瑞典、芬兰及挪威部署总规模达3GWh的储能系统项目。\n这是海辰储能继8月与沙特电力公司签订1GW/4GWh储能项目后，在全球化布"
        },
        {
          "url": "https://news.goalfore.cn/topstories/detail/87273.html",
          "surface": "title",
          "quote": "海辰储能与BOS Power达成合作，助力北欧绿色能源转型"
        },
        {
          "url": "https://news.goalfore.cn/topstories/detail/87273.html",
          "surface": "body",
          "quote": "2025年9月5日，海辰储能宣布与可再生能源领军企业BOS Power（Bertel O. Steen Power Solutions，简称BOS Power）签署合作协议，计划于2027年前在丹麦、瑞典、芬兰及挪威部署总规模达3GWh的储能系统项目。\n签约仪式现场\n该协议覆盖一系列电力储能项目，单体容量3"
        }
      ]
    }
  ]
}
