{
  "schema_version": "storage-taxonomy-decision-v1",
  "campaign_version": "storage-taxonomy-v2-20260813",
  "project_id": "LVA-ES-0001",
  "package_sha256": "95b5e4b3ec72481cf3c199ead2bce230ab3d79eb9e820c890816573f1c5ef37e",
  "role": "terra",
  "model": "gpt-5.6-terra",
  "resolution": "resolved",
  "confidence": 0.94,
  "review_reason": null,
  "canonical_decision": {
    "generation_sources": [],
    "storage_status": "confirmed",
    "storage_power_mw": null,
    "storage_energy_mwh": 200,
    "proposed_category": "储能",
    "proposed_subcategory": null,
    "technology_tags": [],
    "evidence": [
      {
        "url": "https://news.goalfore.cn/topstories/detail/93373.html",
        "surface": "body",
        "quote": "公司与拉脱维亚国家电网正式签订200MWh储能项目订单。"
      }
    ]
  },
  "event_decisions": [
    {
      "event_id": "LVA-ES-0001-01",
      "generation_sources": [],
      "storage_status": "confirmed",
      "storage_power_mw": null,
      "storage_energy_mwh": 200,
      "storage_power_mw_raw": null,
      "storage_energy_mwh_raw": "200MWh",
      "energy_composition_evidence": [
        {
          "url": "https://news.goalfore.cn/topstories/detail/93373.html",
          "surface": "body",
          "quote": "公司与拉脱维亚国家电网正式签订200MWh储能项目订单。"
        }
      ]
    }
  ]
}
