{
  "schema_version": "storage-taxonomy-decision-v1",
  "campaign_version": "storage-taxonomy-v2-20260813",
  "project_id": "ZAF-HB-0004",
  "package_sha256": "482acd0dfb336354c4c13f259a87fff9a248a0a88274e44ed781ac707ebbd0a3",
  "role": "terra",
  "model": "gpt-5.6-terra",
  "resolution": "needs_manual_review",
  "confidence": 0.66,
  "review_reason": "能源构成证据语境存在歧义",
  "canonical_decision": {
    "generation_sources": [
      "光伏"
    ],
    "storage_status": "confirmed",
    "storage_power_mw": 105,
    "storage_energy_mwh": 497,
    "proposed_category": "光伏",
    "proposed_subcategory": null,
    "technology_tags": [
      "光储"
    ],
    "evidence": [
      {
        "url": "https://news.goalfore.cn/topstories/detail/74987.html",
        "surface": "body",
        "quote": "在该保函项下，中国电力建设集团某公司在南非建设大型光伏储能项目，为南非缓解电力紧张、绿色能源转型贡献中国力量。"
      },
      {
        "url": "https://news.goalfore.cn/topstories/detail/56064.html",
        "surface": "title",
        "quote": "中国电建签订南非海卓光储项目EPC和运维合同"
      },
      {
        "url": "https://news.goalfore.cn/topstories/detail/56064.html",
        "surface": "body",
        "quote": "该项目位于南非北开普省德阿镇，是南非政府紧急轮RMIPPPP项目之一，由“216兆瓦光伏+105兆瓦/497兆瓦时储能”组成。"
      }
    ]
  },
  "event_decisions": [
    {
      "event_id": "ZAF-HB-0004-01",
      "generation_sources": [
        "光伏"
      ],
      "storage_status": "confirmed",
      "storage_power_mw": null,
      "storage_energy_mwh": null,
      "storage_power_mw_raw": null,
      "storage_energy_mwh_raw": null,
      "energy_composition_evidence": [
        {
          "url": "https://news.goalfore.cn/topstories/detail/74987.html",
          "surface": "body",
          "quote": "在该保函项下，中国电力建设集团某公司在南非建设大型光伏储能项目，为南非缓解电力紧张、绿色能源转型贡献中国力量。"
        }
      ]
    },
    {
      "event_id": "ZAF-HB-0004-02",
      "generation_sources": [
        "光伏"
      ],
      "storage_status": "confirmed",
      "storage_power_mw": 105,
      "storage_energy_mwh": 497,
      "storage_power_mw_raw": "105兆瓦",
      "storage_energy_mwh_raw": "497兆瓦时",
      "energy_composition_evidence": [
        {
          "url": "https://news.goalfore.cn/topstories/detail/56064.html",
          "surface": "title",
          "quote": "中国电建签订南非海卓光储项目EPC和运维合同"
        },
        {
          "url": "https://news.goalfore.cn/topstories/detail/56064.html",
          "surface": "body",
          "quote": "该项目位于南非北开普省德阿镇，是南非政府紧急轮RMIPPPP项目之一，由“216兆瓦光伏+105兆瓦/497兆瓦时储能”组成。"
        }
      ]
    }
  ]
}
