{"schema_version":"storage-taxonomy-decision-v1","campaign_version":"storage-taxonomy-v2-20260813","project_id":"TUR-MF-0003","package_sha256":"ace84f955e6c2f8cf690fc47468c58576f3626fb5595cbdc011d414313f3b5a9","role":"sol","model":"gpt-5.6-sol","resolution":"resolved","confidence":0.97,"review_reason":null,"canonical_decision":{"generation_sources":[],"storage_status":"not_mentioned","storage_power_mw":null,"storage_energy_mwh":null,"proposed_category":"新能源制造业","proposed_subcategory":null,"technology_tags":[],"evidence":[{"url":"https://news.goalfore.cn/topstories/detail/83505.html","surface":"title","quote":"出海！钧达股份携手Schmid Pekintaş Energy共建土耳其高效电池生产基地"}]},"event_decisions":[{"event_id":"TUR-MF-0003-01","generation_sources":[],"storage_status":"not_mentioned","storage_power_mw":null,"storage_energy_mwh":null,"storage_power_mw_raw":null,"storage_energy_mwh_raw":null,"energy_composition_evidence":[{"url":"https://news.goalfore.cn/topstories/detail/83505.html","surface":"title","quote":"出海！钧达股份携手Schmid Pekintaş Energy共建土耳其高效电池生产基地"}]}],"parent_decision_sha256":"a9fedbd2ca582251c6db30dd6353568d3ac88bb8a22433ea6411426bd0869784"}
