{"schema_version":"storage-taxonomy-decision-v1","campaign_version":"storage-taxonomy-v2-20260813","project_id":"MYS-HB-0012","package_sha256":"caba20a2ccd1b3a4471358e794e452abf38eb5b5dcac5f11d1ad4f539c262002","role":"sol","model":"gpt-5.6-sol","resolution":"resolved","confidence":0.97,"review_reason":null,"canonical_decision":{"generation_sources":["光伏","水电"],"storage_status":"not_mentioned","storage_power_mw":null,"storage_energy_mwh":null,"proposed_category":"综合能源","proposed_subcategory":null,"technology_tags":["光水"],"evidence":[{"url":"https://news.goalfore.cn/topstories/detail/60806.html","surface":"body","quote":"当地时间11月28日，中国电建所属中国水电（马来西亚）有限公司与马来西亚士马勒可再生能源有限公司正式签署马来西亚霹雳州漂浮光伏发电制绿氢及储氢一体化项目EPC总承包合同。"},{"url":"https://news.goalfore.cn/topstories/detail/54335.html","surface":"title","quote":"中国电建签署马来西亚霹雳州漂浮光伏发电制绿氢及储氢一体化项目"},{"url":"https://news.goalfore.cn/topstories/detail/54335.html","surface":"body","quote":"公司承建的巴贡水电站、胡鲁登嘉楼水电站、厦门大学马来西亚分校、沙巴会展中心、登嘉楼马江大型光伏等标志性项目为促进中马经贸合作、推动马来西亚经济社会发展发挥了重要作用。"}]},"event_decisions":[{"event_id":"MYS-HB-0012-01","generation_sources":["光伏"],"storage_status":"not_mentioned","storage_power_mw":null,"storage_energy_mwh":null,"storage_power_mw_raw":null,"storage_energy_mwh_raw":null,"energy_composition_evidence":[{"url":"https://news.goalfore.cn/topstories/detail/60806.html","surface":"body","quote":"当地时间11月28日，中国电建所属中国水电（马来西亚）有限公司与马来西亚士马勒可再生能源有限公司正式签署马来西亚霹雳州漂浮光伏发电制绿氢及储氢一体化项目EPC总承包合同。"}]},{"event_id":"MYS-HB-0012-02","generation_sources":["光伏","水电"],"storage_status":"not_mentioned","storage_power_mw":null,"storage_energy_mwh":null,"storage_power_mw_raw":null,"storage_energy_mwh_raw":null,"energy_composition_evidence":[{"url":"https://news.goalfore.cn/topstories/detail/54335.html","surface":"title","quote":"中国电建签署马来西亚霹雳州漂浮光伏发电制绿氢及储氢一体化项目"},{"url":"https://news.goalfore.cn/topstories/detail/54335.html","surface":"body","quote":"公司承建的巴贡水电站、胡鲁登嘉楼水电站、厦门大学马来西亚分校、沙巴会展中心、登嘉楼马江大型光伏等标志性项目为促进中马经贸合作、推动马来西亚经济社会发展发挥了重要作用。"}]}],"parent_decision_sha256":"4aa8b05c21f54d194c079c4f5bc6359abef9286348492d8de8799d10375a77a8"}
