{"schema_version":"storage-taxonomy-decision-v1","campaign_version":"storage-taxonomy-v2-20260813","project_id":"LAO-PV-0009","package_sha256":"89638edf6ab52309e0b6c5cb2ebb3f1ff5ec618514f69f2409f459a7fa6edc3c","role":"terra","model":"gpt-5.6-terra","resolution":"resolved","confidence":0.98,"review_reason":null,"canonical_decision":{"generation_sources":["光伏"],"storage_status":"confirmed","storage_power_mw":null,"storage_energy_mwh":null,"proposed_category":"光伏","proposed_subcategory":"分布式","technology_tags":["光储"],"evidence":[{"url":"https://news.goalfore.cn/topstories/detail/68488.html","surface":"body","quote":"首个货场屋顶分布式光伏项目"},{"url":"https://news.goalfore.cn/topstories/detail/68488.html","surface":"body","quote":"施工内容主要含光伏方阵布置、配电系统、电气设备控制与保护、储能系统"}]},"event_decisions":[{"event_id":"LAO-PV-0009-01","generation_sources":["光伏"],"storage_status":"confirmed","storage_power_mw":null,"storage_energy_mwh":null,"storage_power_mw_raw":null,"storage_energy_mwh_raw":null,"energy_composition_evidence":[{"url":"https://news.goalfore.cn/topstories/detail/68488.html","surface":"body","quote":"首个货场屋顶分布式光伏项目"},{"url":"https://news.goalfore.cn/topstories/detail/68488.html","surface":"body","quote":"施工内容主要含光伏方阵布置、配电系统、电气设备控制与保护、储能系统"}]}]}
