{"schema_version":"storage-taxonomy-decision-v1","campaign_version":"storage-taxonomy-v2-20260813","project_id":"GBR-ES-0005","package_sha256":"1d96500318aa2cb9f44d47a57d4fdf180251b5ba6313cc207f5ebb33b8c05691","role":"sol","model":"gpt-5.6-sol","resolution":"resolved","confidence":0.94,"review_reason":null,"canonical_decision":{"generation_sources":[],"storage_status":"confirmed","storage_power_mw":null,"storage_energy_mwh":140,"proposed_category":"储能","proposed_subcategory":null,"technology_tags":[],"evidence":[{"url":"https://news.goalfore.cn/topstories/detail/85982.html","surface":"title","quote":"晶科储能与英国AGR公司达成140MWh电网级储能项目合作"},{"url":"https://news.goalfore.cn/topstories/detail/85982.html","surface":"body","quote":"近日，晶科储能（Jinko ESS）与英国领先的能源开发商AGR可再生能源公司（AGR Renewables）达成了一项140MWh电网级储能项目协议。该项目将采用28套晶科储能的G2 5MWh液冷集装箱式系统，首批设备计划于2025年11月交付，项目调试预计在2026年第一季度完成。\nG2系"}]},"event_decisions":[{"event_id":"GBR-ES-0005-01","generation_sources":[],"storage_status":"confirmed","storage_power_mw":null,"storage_energy_mwh":140,"storage_power_mw_raw":null,"storage_energy_mwh_raw":"140MWh","energy_composition_evidence":[{"url":"https://news.goalfore.cn/topstories/detail/85982.html","surface":"title","quote":"晶科储能与英国AGR公司达成140MWh电网级储能项目合作"},{"url":"https://news.goalfore.cn/topstories/detail/85982.html","surface":"body","quote":"近日，晶科储能（Jinko ESS）与英国领先的能源开发商AGR可再生能源公司（AGR Renewables）达成了一项140MWh电网级储能项目协议。该项目将采用28套晶科储能的G2 5MWh液冷集装箱式系统，首批设备计划于2025年11月交付，项目调试预计在2026年第一季度完成。\nG2系"}]}],"parent_decision_sha256":"20c215be69d6befbee33065c77aecb3ca728066696561b9a56e343a2e20a6322"}
