{
  "schema_version": "storage-taxonomy-decision-v1",
  "campaign_version": "storage-taxonomy-v2-20260813",
  "project_id": "IDN-HB-0021",
  "package_sha256": "f0b958feaa86ec6bd0b4fb9531a3b1f70ba6758b4b9189c260d38ef437863647",
  "role": "terra",
  "model": "gpt-5.6-terra",
  "resolution": "needs_manual_review",
  "confidence": 0.7,
  "review_reason": "event evidence contains differing storage capacity values",
  "canonical_decision": {
    "generation_sources": [
      "光伏"
    ],
    "storage_status": "confirmed",
    "storage_power_mw": 70,
    "storage_energy_mwh": 14,
    "proposed_category": "光伏",
    "proposed_subcategory": null,
    "technology_tags": [
      "光储"
    ],
    "evidence": [
      {
        "url": "https://news.goalfore.cn/topstories/detail/78116.html",
        "surface": "body",
        "quote": "印度尼西亚总统普拉博沃视频参会发表致辞，中国能建中电工程党委常委、副总经理，山西院党委书记、董事长王新平受邀视频连线，共同见证印尼IKN50兆瓦光伏及14兆瓦时储能项目顺利完工。\n普拉博沃对所有完工项目表示祝贺，对在项目执行过程中所有参建方的辛勤努力表示感谢和赞赏。他表示，印度尼西亚将持续大力推进能源领域建设，积极发展可再生能源，推进能源结构转型升级。希望各方积极参与到项目建设中，共同促进印度尼西亚绿色转型，更好地惠及印度尼"
      },
      {
        "url": "https://news.goalfore.cn/topstories/detail/78116.html",
        "surface": "body",
        "quote": "印度尼西亚总统普拉博沃视频参会发表致辞，中国能建中电工程党委常委、副总经理，山西院党委书记、董事长王新平受邀视频连线，共同见证印尼IKN50兆瓦光伏及14兆瓦时储能项目顺利完工。\n普拉博沃对所有完工项目表示祝贺，对在项目执行过程中所有参建方的辛勤努力表示感谢和赞赏。他表示，印度尼西亚将持续大力推进能源领域建设，积极发展可再生能源，推进能源结构转型升级。希望各方积极参与到项目建设中，共同促进印度尼西亚绿色转型，更好地惠及印度尼西亚人民。\nPL"
      },
      {
        "url": "https://news.goalfore.cn/topstories/detail/76775.html",
        "surface": "title",
        "quote": "中国能建山西院总承包的印尼 IKN 50兆瓦地面光伏及14兆瓦时储能项目全容量并网"
      },
      {
        "url": "https://news.goalfore.cn/topstories/detail/76775.html",
        "surface": "body",
        "quote": "日前，由中国能建山西院与浙江火电印尼PT公司联合总承包的印尼IKN50兆瓦地面光伏及14兆瓦时储能项目全容量并网成功。\n印尼IKN项目是印尼首个山地光伏加储能项目，在印尼新首都努桑塔拉（IKN Nusantara）绿色清洁能源供应中具有重要作用。该项目充分利用太阳能资源，并配备高效储能系统以确保电力的稳定供应，直流侧总装机容量约70兆瓦，同步配套20兆瓦/14兆瓦时储能系统，"
      },
      {
        "url": "https://news.goalfore.cn/topstories/detail/75467.html",
        "surface": "title",
        "quote": "印尼新首都首个光储一体化项目"
      },
      {
        "url": "https://news.goalfore.cn/topstories/detail/75467.html",
        "surface": "body",
        "quote": "印尼IKN 50兆瓦地面光伏及14兆瓦时储能项目\n成功并网发电\n，标志着\n山西院在印度尼西亚可再生能源市场\n迈出了坚实一步。\n本项目是印尼新首都努桑塔拉（Nusantara）的首个光储一体化项目，也是印尼首个山地光伏项目。项目直流侧总装机容量约为70兆瓦，同步配套20兆瓦/14兆瓦时储能系统，150千伏升压站，总建设面积约"
      },
      {
        "url": "https://news.goalfore.cn/topstories/detail/69775.html",
        "surface": "title",
        "quote": "印尼首个光储一体化项目"
      },
      {
        "url": "https://news.goalfore.cn/topstories/detail/69775.html",
        "surface": "body",
        "quote": "时储能项目开工。\n标志着\n印尼首个山地光储一体化项目\n正式进入建设实施阶段。\n项目位于印尼新首都努桑塔拉建设规模为50兆瓦光伏和14兆瓦时储能。山西院、印尼浙江能源建设有限公司与业主PT胜科印尼能源公司积极配合、提前策划、科学编制施工计划、优化现场施工组织、合理配备物资、高效推进施工、"
      }
    ]
  },
  "event_decisions": [
    {
      "event_id": "IDN-HB-0021-01",
      "generation_sources": [
        "光伏"
      ],
      "storage_status": "confirmed",
      "storage_power_mw": 70,
      "storage_energy_mwh": 14,
      "storage_power_mw_raw": "70兆瓦",
      "storage_energy_mwh_raw": "14兆瓦时",
      "energy_composition_evidence": [
        {
          "url": "https://news.goalfore.cn/topstories/detail/78116.html",
          "surface": "body",
          "quote": "印度尼西亚总统普拉博沃视频参会发表致辞，中国能建中电工程党委常委、副总经理，山西院党委书记、董事长王新平受邀视频连线，共同见证印尼IKN50兆瓦光伏及14兆瓦时储能项目顺利完工。\n普拉博沃对所有完工项目表示祝贺，对在项目执行过程中所有参建方的辛勤努力表示感谢和赞赏。他表示，印度尼西亚将持续大力推进能源领域建设，积极发展可再生能源，推进能源结构转型升级。希望各方积极参与到项目建设中，共同促进印度尼西亚绿色转型，更好地惠及印度尼"
        },
        {
          "url": "https://news.goalfore.cn/topstories/detail/78116.html",
          "surface": "body",
          "quote": "印度尼西亚总统普拉博沃视频参会发表致辞，中国能建中电工程党委常委、副总经理，山西院党委书记、董事长王新平受邀视频连线，共同见证印尼IKN50兆瓦光伏及14兆瓦时储能项目顺利完工。\n普拉博沃对所有完工项目表示祝贺，对在项目执行过程中所有参建方的辛勤努力表示感谢和赞赏。他表示，印度尼西亚将持续大力推进能源领域建设，积极发展可再生能源，推进能源结构转型升级。希望各方积极参与到项目建设中，共同促进印度尼西亚绿色转型，更好地惠及印度尼西亚人民。\nPL"
        },
        {
          "url": "https://news.goalfore.cn/topstories/detail/76775.html",
          "surface": "title",
          "quote": "中国能建山西院总承包的印尼 IKN 50兆瓦地面光伏及14兆瓦时储能项目全容量并网"
        },
        {
          "url": "https://news.goalfore.cn/topstories/detail/76775.html",
          "surface": "body",
          "quote": "日前，由中国能建山西院与浙江火电印尼PT公司联合总承包的印尼IKN50兆瓦地面光伏及14兆瓦时储能项目全容量并网成功。\n印尼IKN项目是印尼首个山地光伏加储能项目，在印尼新首都努桑塔拉（IKN Nusantara）绿色清洁能源供应中具有重要作用。该项目充分利用太阳能资源，并配备高效储能系统以确保电力的稳定供应，直流侧总装机容量约70兆瓦，同步配套20兆瓦/14兆瓦时储能系统，"
        },
        {
          "url": "https://news.goalfore.cn/topstories/detail/75467.html",
          "surface": "title",
          "quote": "印尼新首都首个光储一体化项目"
        },
        {
          "url": "https://news.goalfore.cn/topstories/detail/75467.html",
          "surface": "body",
          "quote": "印尼IKN 50兆瓦地面光伏及14兆瓦时储能项目\n成功并网发电\n，标志着\n山西院在印度尼西亚可再生能源市场\n迈出了坚实一步。\n本项目是印尼新首都努桑塔拉（Nusantara）的首个光储一体化项目，也是印尼首个山地光伏项目。项目直流侧总装机容量约为70兆瓦，同步配套20兆瓦/14兆瓦时储能系统，150千伏升压站，总建设面积约"
        }
      ]
    },
    {
      "event_id": "IDN-HB-0021-02",
      "generation_sources": [
        "光伏"
      ],
      "storage_status": "confirmed",
      "storage_power_mw": 50,
      "storage_energy_mwh": 14,
      "storage_power_mw_raw": "50兆瓦",
      "storage_energy_mwh_raw": "14兆瓦时",
      "energy_composition_evidence": [
        {
          "url": "https://news.goalfore.cn/topstories/detail/69775.html",
          "surface": "title",
          "quote": "印尼首个光储一体化项目"
        },
        {
          "url": "https://news.goalfore.cn/topstories/detail/69775.html",
          "surface": "body",
          "quote": "时储能项目开工。\n标志着\n印尼首个山地光储一体化项目\n正式进入建设实施阶段。\n项目位于印尼新首都努桑塔拉建设规模为50兆瓦光伏和14兆瓦时储能。山西院、印尼浙江能源建设有限公司与业主PT胜科印尼能源公司积极配合、提前策划、科学编制施工计划、优化现场施工组织、合理配备物资、高效推进施工、"
        }
      ]
    }
  ]
}
