{
  "schema_version": "storage-taxonomy-decision-v1",
  "campaign_version": "storage-taxonomy-v2-20260813",
  "project_id": "USA-ES-0002",
  "package_sha256": "798fc7a87792f77e482a9e2d5931bf342ff07bb4da1c5452d799445786ad05d1",
  "role": "terra",
  "model": "gpt-5.6-terra",
  "resolution": "needs_manual_review",
  "confidence": 0.66,
  "review_reason": "能源构成证据语境存在歧义",
  "canonical_decision": {
    "generation_sources": [],
    "storage_status": "confirmed",
    "storage_power_mw": null,
    "storage_energy_mwh": 122,
    "proposed_category": "储能",
    "proposed_subcategory": null,
    "technology_tags": [],
    "evidence": [
      {
        "url": "https://news.goalfore.cn/topstories/detail/89524.html",
        "surface": "body",
        "quote": "该项目总容量高达420兆瓦/2,122兆瓦时，是安大略省目前正在开发中的规模最大的储能设施之一。"
      }
    ]
  },
  "event_decisions": [
    {
      "event_id": "USA-ES-0002-01",
      "generation_sources": [],
      "storage_status": "confirmed",
      "storage_power_mw": null,
      "storage_energy_mwh": 122,
      "storage_power_mw_raw": null,
      "storage_energy_mwh_raw": "122兆瓦时",
      "energy_composition_evidence": [
        {
          "url": "https://news.goalfore.cn/topstories/detail/89524.html",
          "surface": "body",
          "quote": "该项目总容量高达420兆瓦/2,122兆瓦时，是安大略省目前正在开发中的规模最大的储能设施之一。"
        }
      ]
    }
  ]
}
